{
  "$schema": "analytics-pii/1.0",
  "schema_version": "1.0",
  "scope": {
    "input_pattern": "network-log-*.json",
    "apps_scanned": 16,
    "calls_scanned": 212,
    "assessment_rule": "A sent call remains evidence even when body or header values are scrubbed. Scrubbed content is not evidence that PII was absent."
  },
  "static_capabilities": [
    {
      "app": "Nurture Lock",
      "package_name": "com.angry.shark.studio.nurturelock",
      "name": "RevenueCat",
      "assessment": "capability_only"
    },
    {
      "app": "Nurture Lock",
      "package_name": "com.angry.shark.studio.nurturelock",
      "name": "Mixpanel",
      "assessment": "capability_only"
    },
    {
      "app": "Nurture Lock",
      "package_name": "com.angry.shark.studio.nurturelock",
      "name": "Firebase",
      "assessment": "capability_only"
    },
    {
      "app": "Nurture Lock",
      "package_name": "com.angry.shark.studio.nurturelock",
      "name": "AppsFlyer",
      "assessment": "capability_only"
    },
    {
      "app": "Nurture Lock",
      "package_name": "com.angry.shark.studio.nurturelock",
      "name": "Adjust",
      "assessment": "capability_only"
    },
    {
      "app": "Nurture Lock",
      "package_name": "com.angry.shark.studio.nurturelock",
      "name": "OneSignal",
      "assessment": "capability_only"
    },
    {
      "app": "Nurture Lock",
      "package_name": "com.angry.shark.studio.nurturelock",
      "name": "CleverTap",
      "assessment": "capability_only"
    },
    {
      "app": "Nurture Lock",
      "package_name": "com.angry.shark.studio.nurturelock",
      "name": "Tenjin",
      "assessment": "capability_only"
    },
    {
      "app": "Pebbi",
      "package_name": "com.pebbi.android",
      "name": "Firebase Crashlytics",
      "assessment": "capability_only"
    },
    {
      "app": "Pebbi",
      "package_name": "com.pebbi.android",
      "name": "Firebase Installations",
      "assessment": "capability_only"
    },
    {
      "app": "Pebbi",
      "package_name": "com.pebbi.android",
      "name": "Firebase Sessions",
      "assessment": "capability_only"
    },
    {
      "app": "Pebbi",
      "package_name": "com.pebbi.android",
      "name": "Google AdServices",
      "assessment": "capability_only"
    },
    {
      "app": "Pebbi",
      "package_name": "com.pebbi.android",
      "name": "Google Play Install Referrer",
      "assessment": "capability_only"
    },
    {
      "app": "Pebbi",
      "package_name": "com.pebbi.android",
      "name": "RevenueCat",
      "assessment": "capability_only"
    },
    {
      "app": "BabyCenter",
      "package_name": "com.babycenter.pregnancytracker",
      "name": "AppsFlyer",
      "assessment": "capability_only"
    },
    {
      "app": "BabyCenter",
      "package_name": "com.babycenter.pregnancytracker",
      "name": "DoubleClick",
      "assessment": "capability_only"
    },
    {
      "app": "BabyCenter",
      "package_name": "com.babycenter.pregnancytracker",
      "name": "Microsoft Clarity",
      "assessment": "capability_only"
    },
    {
      "app": "BabyCenter",
      "package_name": "com.babycenter.pregnancytracker",
      "name": "Scorecard Research",
      "assessment": "capability_only"
    },
    {
      "app": "BabyCenter",
      "package_name": "com.babycenter.pregnancytracker",
      "name": "Firebase",
      "assessment": "capability_only"
    },
    {
      "app": "BellyBloom",
      "package_name": "com.bellyBloom.pregnancy.tracker",
      "name": "Adjust",
      "assessment": "capability_only"
    },
    {
      "app": "BellyBloom",
      "package_name": "com.bellyBloom.pregnancy.tracker",
      "name": "DoubleClick",
      "assessment": "capability_only"
    },
    {
      "app": "BellyBloom",
      "package_name": "com.bellyBloom.pregnancy.tracker",
      "name": "Facebook",
      "assessment": "capability_only"
    },
    {
      "app": "BellyBloom",
      "package_name": "com.bellyBloom.pregnancy.tracker",
      "name": "Firebase",
      "assessment": "capability_only"
    },
    {
      "app": "Nanit",
      "package_name": "com.nanit.baby",
      "name": "Firebase",
      "assessment": "capability_only"
    },
    {
      "app": "Nanit",
      "package_name": "com.nanit.baby",
      "name": "Microsoft Clarity",
      "assessment": "capability_only"
    },
    {
      "app": "Nanit",
      "package_name": "com.nanit.baby",
      "name": "Localytics",
      "assessment": "capability_only"
    },
    {
      "app": "Nanit",
      "package_name": "com.nanit.baby",
      "name": "Coralogix",
      "assessment": "capability_only"
    },
    {
      "app": "Nanit",
      "package_name": "com.nanit.baby",
      "name": "Cordial",
      "assessment": "capability_only"
    },
    {
      "app": "Nanit",
      "package_name": "com.nanit.baby",
      "name": "Nanit (first-party)",
      "assessment": "capability_only"
    },
    {
      "app": "Pregnancy+",
      "package_name": "com.hp.pregnancy.lite",
      "name": "Firebase",
      "assessment": "capability_only"
    },
    {
      "app": "Pregnancy+",
      "package_name": "com.hp.pregnancy.lite",
      "name": "Facebook",
      "assessment": "capability_only"
    },
    {
      "app": "Pregnancy+",
      "package_name": "com.hp.pregnancy.lite",
      "name": "Microsoft Clarity",
      "assessment": "capability_only"
    },
    {
      "app": "Pregnancy+",
      "package_name": "com.hp.pregnancy.lite",
      "name": "Adapty",
      "assessment": "capability_only"
    },
    {
      "app": "Pregnancy+",
      "package_name": "com.hp.pregnancy.lite",
      "name": "OneSignal",
      "assessment": "capability_only"
    },
    {
      "app": "Pregnancy+",
      "package_name": "com.hp.pregnancy.lite",
      "name": "Philips (first-party)",
      "assessment": "capability_only"
    },
    {
      "app": "What to Expect",
      "package_name": "com.wte.view",
      "name": "AppsFlyer",
      "assessment": "capability_only"
    },
    {
      "app": "What to Expect",
      "package_name": "com.wte.view",
      "name": "Microsoft Clarity",
      "assessment": "capability_only"
    },
    {
      "app": "What to Expect",
      "package_name": "com.wte.view",
      "name": "Scorecard Research",
      "assessment": "capability_only"
    },
    {
      "app": "What to Expect",
      "package_name": "com.wte.view",
      "name": "Firebase",
      "assessment": "capability_only"
    }
  ],
  "vendors": [
    {
      "vendor": "Adapty",
      "hosts": [
        "api-eu.adapty.io",
        "api-ua.adapty.io",
        "fallback.adapty.io",
        "public-media.adapty.io"
      ],
      "apps": [
        "pregnancyplus"
      ],
      "call_count": 21,
      "roles": [
        "analytics",
        "attribution"
      ],
      "pii_categories": [
        "account_or_authentication_data",
        "advertising_or_attribution",
        "app_activity_events"
      ],
      "assessments": [
        "call_metadata_only",
        "call_sent_body_scrubbed",
        "call_sent_header_value_scrubbed",
        "capability_or_endpoint_inference",
        "response_key_names_observed_values_scrubbed"
      ]
    },
    {
      "vendor": "Adjust",
      "hosts": [
        "app.adjust.com"
      ],
      "apps": [
        "bellybloom"
      ],
      "call_count": 2,
      "roles": [
        "attribution"
      ],
      "pii_categories": [
        "account_or_authentication_data",
        "advertising_or_attribution",
        "device_or_app_identifiers"
      ],
      "assessments": [
        "call_sent_body_scrubbed",
        "call_sent_header_value_scrubbed",
        "capability_or_endpoint_inference",
        "response_key_names_observed_values_scrubbed"
      ]
    },
    {
      "vendor": "Amazon Ads",
      "hosts": [
        "c.amazon-adsystem.com",
        "s.amazon-adsystem.com"
      ],
      "apps": [
        "babycenter"
      ],
      "call_count": 2,
      "roles": [
        "advertising"
      ],
      "pii_categories": [
        "advertising_or_attribution",
        "device_or_app_identifiers"
      ],
      "assessments": [
        "call_sent_body_scrubbed",
        "capability_or_endpoint_inference",
        "response_key_names_observed_values_scrubbed"
      ]
    },
    {
      "vendor": "AppsFlyer",
      "hosts": [
        "2snoab.cdn-settings.appsflyersdk.com",
        "2snoab.launches.appsflyersdk.com",
        "a2lve5.cdn-settings.appsflyersdk.com",
        "a2lve5.conversions.appsflyersdk.com",
        "a2lve5.dlsdk.appsflyersdk.com",
        "a2lve5.gcdsdk.appsflyersdk.com",
        "a2lve5.inapps.appsflyersdk.com",
        "a2lve5.pia.appsflyersdk.com",
        "a2lve5.register.appsflyersdk.com"
      ],
      "apps": [
        "babycenter",
        "whattoexpect"
      ],
      "call_count": 13,
      "roles": [
        "attribution",
        "sdk_configuration"
      ],
      "pii_categories": [
        "advertising_or_attribution",
        "device_or_app_identifiers"
      ],
      "assessments": [
        "call_sent_body_scrubbed",
        "capability_or_endpoint_inference",
        "response_key_names_observed_values_scrubbed"
      ]
    },
    {
      "vendor": "Coralogix",
      "hosts": [
        "ingress.eu1.rum-ingress-coralogix.com"
      ],
      "apps": [
        "nanit"
      ],
      "call_count": 1,
      "roles": [
        "analytics",
        "diagnostics"
      ],
      "pii_categories": [
        "account_or_authentication_data",
        "app_activity_events"
      ],
      "assessments": [
        "call_sent_body_scrubbed",
        "call_sent_header_value_scrubbed",
        "response_key_names_observed_values_scrubbed"
      ]
    },
    {
      "vendor": "Cordial",
      "hosts": [
        "events-stream-svc.usw2.cordial.com"
      ],
      "apps": [
        "nanit",
        "whattoexpect"
      ],
      "call_count": 3,
      "roles": [
        "account_or_messaging",
        "analytics"
      ],